{
  "urn": "media:eps;image",
  "title": "EPS, Image",
  "media_type": "application/postscript",
  "documentation": "## File type\nThe concrete file format. Each value identifies a single, well-known format with its\nfile extensions and MIME type. File-type is the identity-tag of file-format media URNs:\n`media:pdf` carries the pdf file-type marker, `media:json;textable;record` carries the\njson file-type marker.\n\nThe file-type dim is authored across multiple fragment files in `fabric/dims/file-type/`\ngrouped by category (image, audio, video, archive, document, source, font, model,\ndata, config, web, other). Fragment merging produces a single global file-type dim\ncatalogue.\n\nEPS (Encapsulated PostScript). Vector or raster image embedded in a self-contained\nPostScript document.\n\n## Medium\nMedium tags declare the primary human-perceivable nature of a value: visual, audible,\ntextual, etc. Medium is what a person experiences when consuming the value. Some media\ntypes carry multiple media tags (a PDF is both visual when displayed and textable when\nits text layer is extracted).\n\nMedium should not be confused with coercion: `textable` (coercion) means \"can be\nencoded as UTF-8 text without loss\"; `textual` (medium) means \"is fundamentally text\nto a human reader.\" A JSON config is textable but not necessarily textual in this\nsense — it is structured data that happens to be text-encoded.\n\nThe value is a visual artifact intended to be seen: a photo, screenshot, rendered\ndiagram, or icon. Caps that consume images (vision models, image describers) match\non this tag rather than on a specific format like PNG or JPEG.",
  "extensions": [
    "eps"
  ]
}