{
  "urn": "media:gguf;llm;model-spec;phi;textable",
  "media_type": "text/plain",
  "title": "GGUF Phi LLM Model Spec",
  "profile_uri": "https://capdag.com/schema/model_spec",
  "description": "GGUF model specification for Phi-family language models.",
  "documentation": "## Purpose\nCombines the GGUF backend tag with the Phi family tag, fully resolving the model to a GGUF Phi instruct model. The runtime applies both the correct GGUF loading path and the `<|user|>` / `<|end|>` chat template.\n\n## When to use\nThis URN is assigned by the ValueAdapter after inspecting a GGUF model file and confirming it is a Phi-family model. Use it in cap selectors to match only GGUF Phi models.\n\n## Notes\nThis is a composed tag produced at runtime; it is not typically specified manually by users.\n",
  "extensions": [
    "txt"
  ],
  "validation": {
    "max_length": 512,
    "min_length": 1,
    "pattern": "^(?:hf|local|file|url|http|https|s3|gs):\\S+$"
  }
}