{
  "urn": "media:gguf;model-spec;textable",
  "title": "Model Spec (Textable, GGUF (llama.cpp))",
  "media_type": "text/plain",
  "profile_uri": "https://capdag.com/schema/model_spec",
  "description": "Model specification (scheme:identifier string identifying a machine-learning model).",
  "documentation": "## Purpose\nA model spec is a compact string that uniquely identifies a machine learning model\nand tells the system where to find it. The format is `<scheme>:<identifier>` with\nan optional query string for filtering (e.g. `hf:org/model-name?include=*Q8_0*`).\nThe scheme determines which backend or repository resolves the spec.\n\n## Tag axes\nThe base anchor `model-spec` may be specialised along three orthogonal axes:\nbackend (gguf / mlx / candle), model-task (llm / vision / embeddings /\nimage-embeddings / transcription), and family (mistral / llama / phi / qwen).\nBackend-agnostic specs simply omit the backend tag.\n\n## Notes\nThe validation regex requires the scheme separator colon to be present and forbids\nembedded whitespace in the identifier. Strings of up to 512 characters are allowed\nto accommodate long query strings.\n\n## Textable\nCoercion marker indicating the value is faithfully representable as UTF-8 text.\nStrings are textable trivially; integers and booleans are textable via their\nstring form; structured values are textable when JSON-serialised. Binary blobs\n(images, audio, raw bytes) are NOT textable — converting them to text requires\nexplicit transformation that may be lossy.\n\nThe value is faithfully representable as UTF-8 text without loss.\n\n## Backend\nThe inference framework or runtime that loads and executes a model. Backend choice\ndetermines weight format, hardware acceleration, and runtime characteristics. A media\nURN that omits the backend tag is backend-agnostic — it accepts any backend.\n\nGGUF is the llama.cpp container format. Quantised weights packaged into a single\nfile with embedded metadata. Runs efficiently on CPU and via Metal/CUDA acceleration.\nStandard format for general-purpose LLM and embedding inference across hardware.",
  "validation": {
    "pattern": "^(?:hf|local|file|url|http|https|s3|gs):\\S+$",
    "min_length": 1,
    "max_length": 512
  }
}