{
  "urn": "media:llm;mlx;model-spec;phi;textable",
  "title": "Model Spec (Textable, MLX (Apple Silicon), LLM, Phi)",
  "media_type": "text/plain",
  "profile_uri": "https://capdag.com/schema/model_spec",
  "description": "Model specification (scheme:identifier string identifying a machine-learning model).",
  "documentation": "## Purpose\nA model spec is a compact string that uniquely identifies a machine learning model\nand tells the system where to find it. The format is `<scheme>:<identifier>` with\nan optional query string for filtering (e.g. `hf:org/model-name?include=*Q8_0*`).\nThe scheme determines which backend or repository resolves the spec.\n\n## Tag axes\nThe base anchor `model-spec` may be specialised along three orthogonal axes:\nbackend (gguf / mlx / candle), model-task (llm / vision / embeddings /\nimage-embeddings / transcription), and family (mistral / llama / phi / qwen).\nBackend-agnostic specs simply omit the backend tag.\n\n## Notes\nThe validation regex requires the scheme separator colon to be present and forbids\nembedded whitespace in the identifier. Strings of up to 512 characters are allowed\nto accommodate long query strings.\n\n## Textable\nCoercion marker indicating the value is faithfully representable as UTF-8 text.\nStrings are textable trivially; integers and booleans are textable via their\nstring form; structured values are textable when JSON-serialised. Binary blobs\n(images, audio, raw bytes) are NOT textable — converting them to text requires\nexplicit transformation that may be lossy.\n\nThe value is faithfully representable as UTF-8 text without loss.\n\n## Backend\nThe inference framework or runtime that loads and executes a model. Backend choice\ndetermines weight format, hardware acceleration, and runtime characteristics. A media\nURN that omits the backend tag is backend-agnostic — it accepts any backend.\n\nMLX is Apple's array framework for machine learning, native to Apple Silicon. Models\nare stored as safetensors with MLX-specific config. Exploits the unified memory\narchitecture of M-series chips for fast, energy-efficient inference. Apple Silicon\nonly.\n\n## Model task\nThe inference modality of a model. Model-task narrows what kind of inference cap a\nmodel spec is suitable for: an LLM cannot serve transcription, a transcription model\ncannot serve text generation. The task tag is part of the model-spec URN; it is set\nby the cap declaring its model-spec input slot, not derived from the model file.\n\nCausal language model for text generation and instruction following. Accepts a text\nprompt and produces a text continuation, typically token-by-token via streaming.\n\n## Family\nThe model family — its architectural lineage. Families share chat templates, tokenizer\nconfigurations, and structural assumptions. The runtime applies family-specific prompt\nformatting (e.g. `[INST]/[/INST]` for Mistral, header_id for Llama 3) when invoking\ninference. Family is detected from the model spec by content inspection.\n\nMicrosoft's Phi family (Phi-2, Phi-3, Phi-3.5). Uses `<|user|>` / `<|end|>` chat\ntemplate. Compact (1B–7B parameters) models optimised for reasoning tasks.",
  "validation": {
    "pattern": "^(?:hf|local|file|url|http|https|s3|gs):\\S+$",
    "min_length": 1,
    "max_length": 512
  }
}