{
  "urn": "media:numeric;textable",
  "title": "Numeric, Textable",
  "media_type": "text/plain",
  "description": "Numeric primitive (integer or real) optionally as a list",
  "documentation": "## Numeric\nCoercion marker indicating the value supports numeric operations (addition,\ncomparison, ordering). Independent of `textable`; a numeric value is often\nalso textable (an integer is encodable as text), but neither implies the\nother in general.\n\nThe value supports numeric operations.\n\n## Textable\nCoercion marker indicating the value is faithfully representable as UTF-8 text.\nStrings are textable trivially; integers and booleans are textable via their\nstring form; structured values are textable when JSON-serialised. Binary blobs\n(images, audio, raw bytes) are NOT textable — converting them to text requires\nexplicit transformation that may be lossy.\n\nThe value is faithfully representable as UTF-8 text without loss."
}